{
  "alert_id": "<uuid>",
  "alert_type": "LEADERSHIP_ROTATION",
  "conditions": {
    "input_snapshot": {
      "eth_btc_rs": 0.05,
      "eth_btc_rs_zscore": 2.1
    },
    "trigger_values": {
      "direction": "outperform",
      "pair": "ETH/BTC",
      "rs_zscore": 2.1
    }
  },
  "context": {
    "confidence": 0.8,
    "regime": "RISK_ON_TREND"
  },
  "cooldown_until": "2026-03-01T11:00:00+00:00",
  "message": "LEADERSHIP_ROTATION triggered: pair=ETH/BTC, rs_zscore=2.1, direction=outperform",
  "severity": "MEDIUM",
  "symbol": null,
  "time": "2026-03-01T09:00:00+00:00"
}
